{
  "$schema": "http://json-schema.org/draft-07/schema#",
  "$id": "https://axicharts.dev/schema/cartesian-panel.schema.json",
  "title": "CartesianPanelSpec",
  "description": "RFC-002 cartesian dashboard panel — type cartesian with marks[] only.",
  "type": "object",
  "required": [
    "type",
    "encoding",
    "marks"
  ],
  "additionalProperties": true,
  "$defs": {
    "barMark": {
      "oneOf": [
        {
          "type": "object",
          "required": [
            "mark",
            "field"
          ],
          "additionalProperties": false,
          "properties": {
            "mark": {
              "const": "bar"
            },
            "field": {
              "type": "string"
            },
            "label": {
              "type": "string"
            },
            "tone": {
              "enum": [
                "default",
                "info",
                "success",
                "warning",
                "critical"
              ]
            },
            "yAxisId": {
              "enum": [
                "left",
                "right"
              ]
            },
            "stack": {
              "type": "string"
            },
            "labels": {
              "type": "boolean"
            },
            "curve": {
              "enum": [
                "linear",
                "monotone"
              ]
            }
          }
        },
        {
          "type": "object",
          "required": [
            "type",
            "field"
          ],
          "additionalProperties": false,
          "properties": {
            "type": {
              "const": "bar"
            },
            "field": {
              "type": "string"
            },
            "label": {
              "type": "string"
            },
            "tone": {
              "enum": [
                "default",
                "info",
                "success",
                "warning",
                "critical"
              ]
            },
            "yAxisId": {
              "enum": [
                "left",
                "right"
              ]
            },
            "stack": {
              "type": "string"
            },
            "labels": {
              "type": "boolean"
            },
            "curve": {
              "enum": [
                "linear",
                "monotone"
              ]
            }
          }
        }
      ]
    },
    "lineMark": {
      "oneOf": [
        {
          "type": "object",
          "required": [
            "mark",
            "field"
          ],
          "additionalProperties": false,
          "properties": {
            "mark": {
              "const": "line"
            },
            "field": {
              "type": "string"
            },
            "label": {
              "type": "string"
            },
            "tone": {
              "enum": [
                "default",
                "info",
                "success",
                "warning",
                "critical"
              ]
            },
            "yAxisId": {
              "enum": [
                "left",
                "right"
              ]
            },
            "stack": {
              "type": "string"
            },
            "labels": {
              "type": "boolean"
            },
            "curve": {
              "enum": [
                "linear",
                "monotone"
              ]
            }
          }
        },
        {
          "type": "object",
          "required": [
            "type",
            "field"
          ],
          "additionalProperties": false,
          "properties": {
            "type": {
              "const": "line"
            },
            "field": {
              "type": "string"
            },
            "label": {
              "type": "string"
            },
            "tone": {
              "enum": [
                "default",
                "info",
                "success",
                "warning",
                "critical"
              ]
            },
            "yAxisId": {
              "enum": [
                "left",
                "right"
              ]
            },
            "stack": {
              "type": "string"
            },
            "labels": {
              "type": "boolean"
            },
            "curve": {
              "enum": [
                "linear",
                "monotone"
              ]
            }
          }
        }
      ]
    },
    "areaMark": {
      "oneOf": [
        {
          "type": "object",
          "required": [
            "mark",
            "field"
          ],
          "additionalProperties": false,
          "properties": {
            "mark": {
              "const": "area"
            },
            "field": {
              "type": "string"
            },
            "label": {
              "type": "string"
            },
            "tone": {
              "enum": [
                "default",
                "info",
                "success",
                "warning",
                "critical"
              ]
            },
            "yAxisId": {
              "enum": [
                "left",
                "right"
              ]
            },
            "stack": {
              "type": "string"
            },
            "labels": {
              "type": "boolean"
            },
            "curve": {
              "enum": [
                "linear",
                "monotone"
              ]
            }
          }
        },
        {
          "type": "object",
          "required": [
            "type",
            "field"
          ],
          "additionalProperties": false,
          "properties": {
            "type": {
              "const": "area"
            },
            "field": {
              "type": "string"
            },
            "label": {
              "type": "string"
            },
            "tone": {
              "enum": [
                "default",
                "info",
                "success",
                "warning",
                "critical"
              ]
            },
            "yAxisId": {
              "enum": [
                "left",
                "right"
              ]
            },
            "stack": {
              "type": "string"
            },
            "labels": {
              "type": "boolean"
            },
            "curve": {
              "enum": [
                "linear",
                "monotone"
              ]
            }
          }
        }
      ]
    },
    "pointMark": {
      "oneOf": [
        {
          "type": "object",
          "required": [
            "mark",
            "field"
          ],
          "additionalProperties": false,
          "properties": {
            "mark": {
              "const": "point"
            },
            "field": {
              "type": "string"
            },
            "label": {
              "type": "string"
            },
            "tone": {
              "enum": [
                "default",
                "info",
                "success",
                "warning",
                "critical"
              ]
            },
            "yAxisId": {
              "enum": [
                "left",
                "right"
              ]
            },
            "stack": {
              "type": "string"
            },
            "labels": {
              "type": "boolean"
            },
            "curve": {
              "enum": [
                "linear",
                "monotone"
              ]
            }
          }
        },
        {
          "type": "object",
          "required": [
            "type",
            "field"
          ],
          "additionalProperties": false,
          "properties": {
            "type": {
              "const": "point"
            },
            "field": {
              "type": "string"
            },
            "label": {
              "type": "string"
            },
            "tone": {
              "enum": [
                "default",
                "info",
                "success",
                "warning",
                "critical"
              ]
            },
            "yAxisId": {
              "enum": [
                "left",
                "right"
              ]
            },
            "stack": {
              "type": "string"
            },
            "labels": {
              "type": "boolean"
            },
            "curve": {
              "enum": [
                "linear",
                "monotone"
              ]
            }
          }
        }
      ]
    },
    "ruleMark": {
      "oneOf": [
        {
          "type": "object",
          "required": [
            "mark",
            "value"
          ],
          "additionalProperties": false,
          "properties": {
            "mark": {
              "const": "rule"
            },
            "value": {
              "type": "number"
            },
            "label": {
              "type": "string"
            },
            "tone": {
              "enum": [
                "default",
                "info",
                "success",
                "warning",
                "critical"
              ]
            },
            "orientation": {
              "enum": [
                "horizontal",
                "vertical"
              ]
            },
            "x": {
              "type": [
                "number",
                "string"
              ]
            },
            "id": {
              "type": "string"
            }
          }
        },
        {
          "type": "object",
          "required": [
            "type",
            "value"
          ],
          "additionalProperties": false,
          "properties": {
            "type": {
              "const": "rule"
            },
            "value": {
              "type": "number"
            },
            "label": {
              "type": "string"
            },
            "tone": {
              "enum": [
                "default",
                "info",
                "success",
                "warning",
                "critical"
              ]
            },
            "orientation": {
              "enum": [
                "horizontal",
                "vertical"
              ]
            },
            "x": {
              "type": [
                "number",
                "string"
              ]
            },
            "id": {
              "type": "string"
            }
          }
        }
      ]
    },
    "bandMark": {
      "oneOf": [
        {
          "type": "object",
          "required": [
            "mark",
            "min",
            "max"
          ],
          "additionalProperties": false,
          "properties": {
            "mark": {
              "const": "band"
            },
            "min": {
              "type": "number"
            },
            "max": {
              "type": "number"
            },
            "label": {
              "type": "string"
            },
            "tone": {
              "enum": [
                "default",
                "info",
                "success",
                "warning",
                "critical"
              ]
            },
            "id": {
              "type": "string"
            }
          }
        },
        {
          "type": "object",
          "required": [
            "type",
            "min",
            "max"
          ],
          "additionalProperties": false,
          "properties": {
            "type": {
              "const": "band"
            },
            "min": {
              "type": "number"
            },
            "max": {
              "type": "number"
            },
            "label": {
              "type": "string"
            },
            "tone": {
              "enum": [
                "default",
                "info",
                "success",
                "warning",
                "critical"
              ]
            },
            "id": {
              "type": "string"
            }
          }
        }
      ]
    },
    "textMark": {
      "oneOf": [
        {
          "type": "object",
          "required": [
            "mark",
            "text",
            "y"
          ],
          "additionalProperties": false,
          "properties": {
            "mark": {
              "const": "text"
            },
            "text": {
              "type": "string"
            },
            "y": {
              "type": "number"
            },
            "x": {
              "type": [
                "number",
                "string"
              ]
            },
            "tone": {
              "enum": [
                "default",
                "info",
                "success",
                "warning",
                "critical"
              ]
            },
            "position": {
              "enum": [
                "top",
                "bottom",
                "left",
                "right",
                "center"
              ]
            },
            "id": {
              "type": "string"
            }
          }
        },
        {
          "type": "object",
          "required": [
            "type",
            "text",
            "y"
          ],
          "additionalProperties": false,
          "properties": {
            "type": {
              "const": "text"
            },
            "text": {
              "type": "string"
            },
            "y": {
              "type": "number"
            },
            "x": {
              "type": [
                "number",
                "string"
              ]
            },
            "tone": {
              "enum": [
                "default",
                "info",
                "success",
                "warning",
                "critical"
              ]
            },
            "position": {
              "enum": [
                "top",
                "bottom",
                "left",
                "right",
                "center"
              ]
            },
            "id": {
              "type": "string"
            }
          }
        }
      ]
    },
    "markerMark": {
      "oneOf": [
        {
          "type": "object",
          "required": [
            "mark",
            "y"
          ],
          "additionalProperties": false,
          "properties": {
            "mark": {
              "const": "marker"
            },
            "y": {
              "type": "number"
            },
            "x": {
              "type": [
                "number",
                "string"
              ]
            },
            "label": {
              "type": "string"
            },
            "tone": {
              "enum": [
                "default",
                "info",
                "success",
                "warning",
                "critical"
              ]
            },
            "draggable": {
              "type": "boolean"
            },
            "id": {
              "type": "string"
            }
          }
        },
        {
          "type": "object",
          "required": [
            "type",
            "y"
          ],
          "additionalProperties": false,
          "properties": {
            "type": {
              "const": "marker"
            },
            "y": {
              "type": "number"
            },
            "x": {
              "type": [
                "number",
                "string"
              ]
            },
            "label": {
              "type": "string"
            },
            "tone": {
              "enum": [
                "default",
                "info",
                "success",
                "warning",
                "critical"
              ]
            },
            "draggable": {
              "type": "boolean"
            },
            "id": {
              "type": "string"
            }
          }
        }
      ]
    }
  },
  "properties": {
    "specVersion": {
      "type": "integer",
      "const": 1
    },
    "type": {
      "type": "string",
      "const": "cartesian"
    },
    "title": {
      "type": "string"
    },
    "mode": {
      "enum": [
        "static",
        "interactive",
        "live"
      ]
    },
    "theme": {
      "enum": [
        "clean",
        "studio",
        "live",
        "dark"
      ]
    },
    "height": {
      "type": "number",
      "minimum": 80
    },
    "encoding": {
      "type": "object",
      "required": [
        "x"
      ],
      "properties": {
        "x": {
          "type": "object",
          "required": [
            "field"
          ],
          "properties": {
            "field": {
              "type": "string"
            },
            "label": {
              "type": "string"
            }
          }
        }
      }
    },
    "marks": {
      "type": "array",
      "minItems": 1,
      "items": {
        "oneOf": [
          {
            "$ref": "#/$defs/barMark"
          },
          {
            "$ref": "#/$defs/lineMark"
          },
          {
            "$ref": "#/$defs/areaMark"
          },
          {
            "$ref": "#/$defs/pointMark"
          },
          {
            "$ref": "#/$defs/ruleMark"
          },
          {
            "$ref": "#/$defs/bandMark"
          },
          {
            "$ref": "#/$defs/textMark"
          },
          {
            "$ref": "#/$defs/markerMark"
          }
        ]
      }
    }
  }
}
